{
  "v": 1,
  "build": "sonoff4chpro-lease-v1",
  "sketch_md5": "00000000000000000000000000000000",
  "kind": "reply",
  "id": "example-acquire",
  "op": "acquire",
  "accepted": true,
  "duplicate": true,
  "code": "duplicate",
  "device": "AA:BB:CC:DD:EE:FF",
  "generation": "11111111111111111111111111111111",
  "connected": true,
  "active": false,
  "mask": 0,
  "gpio_mask": 0,
  "gpio_match": true,
  "state_evidence": "gpio_output_readback",
  "board_ok": true,
  "now_ms": 901000,
  "lease_until_ms": 0,
  "end_ms": 1800000,
  "owner": "example-owner",
  "treatment": 1,
  "seq": 1,
  "highwater": 1,
  "reason": "expired",
  "max_lease_ms": 900000
}
