{
  "v": 1,
  "build": "sonoff4chpro-lease-v1",
  "sketch_md5": "00000000000000000000000000000000",
  "kind": "reply",
  "id": "example-challenge",
  "op": "challenge",
  "accepted": true,
  "duplicate": false,
  "code": "ok",
  "device": "AA:BB:CC:DD:EE:FF",
  "generation": "11111111111111111111111111111111",
  "connected": true,
  "active": false,
  "mask": 0,
  "gpio_mask": 0,
  "gpio_match": true,
  "state_evidence": "gpio_output_readback",
  "board_ok": true,
  "now_ms": 1000,
  "lease_until_ms": 0,
  "end_ms": 0,
  "owner": "",
  "treatment": 0,
  "seq": 0,
  "highwater": 0,
  "reason": "connected",
  "max_lease_ms": 900000,
  "challenge": "22222222222222222222222222222222",
  "issued_ms": 1000,
  "lifetime_ms": 2000
}
